OrderNumber,OrderStatus,CustomerNumber,CustomerName,OrderDate,ShipDate,PromisedDate,Closed,CreditHold,OnHold,BlanketOrder,Amount,OrderType,CustomerPurchaseOrderNumber,SalesAgent,Division,Warehouse,TaxCode,ShipperID,Attention,FOB,FreightOption,FreightAmount,FreightCost,Email,FreeField1,FreeField2,OrderRemarks,InternalRemarks,OrderRemark3,OrderRemark4,ShipToSequence,ShipToName,ShipToAddress1,ShipToAddress2,ShipToAddress3,ShipToCity,ShipToState,ShipToZip,ShipToCountry,Phone,ShipFromName,ShipFromAddress1,ShipFromAddress2,ShipFromAddress3,ShipFromCity,ShipFromState,ShipFromZip,ShipFromCountry,MiscCharge1,MiscCharge1GL,MiscCharge1Reason,MiscCharge1Tax,MiscCharge2,MiscCharge2GL,MiscCharge2Reason,MiscCharge2Tax,MiscCharge3,MiscCharge3GL,MiscCharge3Reason,MiscCharge3Tax,MiscCharge4,MiscCharge4GL,MiscCharge4Reason,MiscCharge4Tax,NumberOfPallets,ShippingZone,Truck,TruckRunId,TruckRunDate,StopNumber,StandingOrderRelease,ExternalTracking,CreateDate,UpdateDate,items,CustomFields,Month,Week
900417,Entered,0009901,Dixie Chemical Company,2025-01-06 05:00:00,2025-03-11T00:00:00-04:00,2025-02-19T00:00:00-05:00,True,False,False,False,43491.0,1,PO010763,0008,1,1,100,FEDEX FRT PRIOR,Angie Junemann,"EXW San Antonio, TX",COLLECT,,,jrbrown@dixiechemical.com,CFR49-HM181,,,"FedEx Acct No.: 1065-3548-5 
(Please verify account with customer due to past invalid accounts)                 
                                           
 Send Invoice to : APayable@dixiechemical.com

TX Sales Tax: On File

Dixie receiving hours are 6am-1pm M-F.
Deliveries outside receiving hours will require a drop.
Dixie will not be
responsible for any fees due to
deliveries outside receiving hours.
Maintenance receiving hours are 7:30am-4pm M-F
COA MUST accompany product delivery and must reference
product description and/or Item ID used on the purchase order

All documents must include PO number.PO010763

Only use new material. Do not mix with material in stock for this order.",,,2,Dixie Chemical Company- Plant A,10701 Bay Area Blvd,Gate 1,,Pasadena,TX,77507,USA,(281) 474-3271,Noah Chemicals,1 Noah Park,,,San Antonio,TX,78249,United States,,,,,,,,,,,,,,,,,,,,,,0,False,,2025-01-08T14:20:28.417-05:00,2025-03-11T15:21:43.587-04:00,[],{},2025-01-01,2025-01-06
900418,Entered,15019,"NuVision Engineering, Inc.",2025-01-02 05:00:00,2025-02-13T00:00:00-05:00,2025-01-28T00:00:00-05:00,True,True,False,False,620.2431,1,21807,0006,1,1,100,UPS GROUND,John Ritter,EXW San Antonio,PPD & ADDED,,,ritter@nuvisioneng.com,UPS Ground / FedEx Ground,NO GHS Label required,,email John Ritter - ritter@nuvisioneng.com for shipping information. Freight will be determined as its closer to be ready to ship,,,2,Battelle for US DOE,790 6th St,Attn Amanda Lines,Request ID RCV61063,Richland,WA,99354,United States,704 799 2707,Noah Chemicals,1 Noah Park,,,San Antonio,TX,78249,United States,,,,,,,,,,,,,,,,,,,,,,0,False,,2025-01-08T14:28:58.413-05:00,2025-02-13T16:10:33.677-05:00,[],{},2025-01-01,2024-12-30
900419,Entered,0002090,Thermo Fisher Scientific,2025-01-08 05:00:00,2025-01-15T00:00:00-05:00,2025-01-14T00:00:00-05:00,True,False,False,False,1403.272,1,446975,0024,1,1,100,R & L CARRIERS,Cathy Thompson,EXWorks SanAntonioTX,COLLECT,,,jeff.oconnor@alfa.com,CFR49-HM181,,,"SPECIAL INSTRUCTIONS:

R&L Carriers: TH38SH 

Certificate of Origin required with all shipments

PO Number 446975 must be on all shipping documents and labels

Tech data must state the following:  
This material is chemically synthesized
Country of Origin: ____

All products must have the following marked on the inner labels and outer packaging:
Country of Origin: ____

Email invoice to alfaaesar.accountspay@thermofisher.com

Email tracking information to Cathy.Thompson@ThermoFisher.com

Email Tech Data Sheet and SDS to QCdocs@alfa.com

Email Tech Data Sheet and Certificate of Origin to alfaaesar.qcdocs@thermofisher.com

LTL Carrier should always be R&L:
    

FOR SHIPMENTS TO WARD HILL, MA:

Do not declare a value for insurance purposes
Do not declare a value for carriage
PO No 446975 must be put in the proper field for FedEx and UPS shipments
PO No 446975 must be on BOL
Shipping paperwork should reflect the name Thermo Fisher Scientific 

The P.O. will specify the method of shipment. In most cases this will be either FedEx or UPS. Should the P.O. specify UPS or FedEx and the order cannot ship small package (due to size or carrier restrictions) please ship LTL using the following chart to determine the correct carrier.",,,6,Thermo Fisher Scientific,Alfa Aesar,30 Bond Street,,Ward Hill,MA,01835,USA,(978) 521-6490,Noah Chemicals,1 Noah Park,,,San Antonio,TX,78249,United States,,,,,,,,,,,,,,,,,,,,,,0,False,,2025-01-08T16:36:39.87-05:00,2025-01-16T17:34:25.34-05:00,[],{},2025-01-01,2025-01-06
900420,Entered,0013076,Infiniumco,2025-01-08 05:00:00,2025-01-16T00:00:00-05:00,2025-01-15T00:00:00-05:00,True,False,False,False,4540.51,1,PO1317,0008,1,1,100,AMINO,Joel Gamoras,"EXW San Antonio, TX",PPD & ADDED,,,,CFR49-HM181,,,"Email invoices to: accounting@infiniumco.com

Lift gate with pallet jack delivery required as customer does not have a dock or forklift

Amino Quote # for XPO Logistics: 121640661",,,1,Infiniumco,1050 Riverside Parkway,Suite 140,,Sacramento,CA,95605,USA,(707) 328-5510,Noah Chemicals,1 Noah Park,,,San Antonio,TX,78249,United States,,,,,,,,,,,,,,,,,,,,,,0,False,,2025-01-08T16:51:23.587-05:00,2025-01-21T16:10:28.337-05:00,[],{},2025-01-01,2025-01-06
900421,Entered,0006610,Spectrum Chemical Mfg. Corp,2025-01-06 05:00:00,2025-01-15T00:00:00-05:00,2025-01-15T00:00:00-05:00,True,False,False,False,1010.5,1,1426329,0024,1,1,100,UPS GROUND,Nancy Shen,EXWorks SanAntonioTX,COLLECT,,,,UPS Ground / FedEx Ground,PO No. 1426329,,"SPECIAL INSTRUCTIONS: 

UPS Acct. No. 4X2-97X

Certificate of Origin required for all shipments.

Material must be one lot unless prior authorization granted by agent.

PO No 1426329 must be on product label and BOL

Send COA for QA approval prior to shipping

COA must arrive prior to receipt of shipment and also accompany shipment

The following information must be on the tech data sheet:  Country of Origin, Date of Mfg and Retest date (minimum of 2 years shelf-life required)

The following must be on the BOL: Send freight bill with copy of BOL to Freight Management, Inc., c/o Spectrum Chemicals, 2900 E. La Palma Ave. Anaheim, CA 92806.

Email TDS and tracking number to:  ________________@spectrumchemical.com

Submit copy of invoice with original bill of lading to billing address listed 

Email another copy of invoice to:  ap@spectrumchemical.com",,,1,Spectrum Chemical Mfg. Corp.,755 Jersey Avenue,,,New Brunswick,NJ,08901-3605,,,Noah Chemicals,1 Noah Park,,,San Antonio,TX,78249,United States,,,,,,,,,,,,,,,,,,,,,,0,False,,2025-01-08T17:07:20.953-05:00,2025-01-17T09:37:51.323-05:00,[],{},2025-01-01,2025-01-06
900422,Entered,0012559,PPG Aerospace,2025-01-08 05:00:00,2025-02-19T00:00:00-05:00,2025-02-20T00:00:00-05:00,True,False,False,False,429.408,1,VAZ18325,0012,1,1,100,FEDEX PRIORITY,Nicole Babayans,ExWorks SanAntonioTX,COLLECT,,,nbabayans@ppg.com,IATA,,,"FedEx account # 1235 3027 6 

Email Invoice to: Aly.Zepeda@ppg.com

PO No. VAZ18325  must be on all shipping documents

Email Invoice to: Aly.Zepeda@ppg.com

PO No. must be on all shipping documents",,,-2,PPG Aerospace,Attn: Nicole Babayans,2820 W. Empire Ave.,,Burbank,CA,91504,USA,818-524-4392,Noah Chemicals,1 Noah Park,,,San Antonio,TX,78249,United States,,,,,,,,,,,,,,,,,,,,,,0,False,,2025-01-08T17:19:25.39-05:00,2025-02-19T14:51:28.43-05:00,[],{},2025-01-01,2025-01-06
900423,Entered,0008525,"Strem Chemicals, Inc.",2024-12-02 05:00:00,2025-01-13T00:00:00-05:00,2025-01-13T00:00:00-05:00,True,False,False,False,682.0,1,P24120008,0012,1,1,100,FEDEX GROUND,Clark Webb,ExWorks-SanAntonioTx,COLLECT,,,pam@strem.com,UPS Ground / FedEx Ground,,SAGE sales order # 882546,"FedEx Small Parcel Acct. No. 0021-2548-0 

Include the country of origin, color and form of the material on the tech data and email prior to shipment to Clark Webb at cwebb@ascensusspecialties.com for approval prior to shipping.

Email invoice to AP-NBPT@ascensusspecialties.com, cc Clark Webb at cwebb@ascensusspecialties.com

Email tracking number and SDS to logistics-nbt@ascensusspecialties.com and cClark Webb at cwebb@ascensusspecialties.com",,,2,"Strem Chemicals, Inc.",6 Mulliken Way,Dexter Industrial Park,,Newburyport,MA,01950-4098,,(978) 499-1600,Noah Chemicals,1 Noah Park,,,San Antonio,TX,78249,United States,,,,,,,,,,,,,,,,,,,,,,0,False,,2025-01-09T09:41:46.403-05:00,2025-01-14T17:19:31.737-05:00,[],{},2024-12-01,2024-12-02
900424,Entered,0014250,"TD*X Associates, LP",2024-11-12 05:00:00,2025-01-14T00:00:00-05:00,2024-11-26T00:00:00-05:00,True,False,False,False,1558.0,1,1044-669JS24111,00,1,1,100,R & L CARRIERS,Jose Salazar,Exworks-SanAntonioTX,THIRD PARTY,,,,CFR49-HM181,,SAGE: sales order #0881743,"Arrange pickup with Amino Freight. 
Please see Glen if needed.

Electronic billing to be sent to lgorton@tdxassociates.com

Confirm order confirmation details to Jose Salazar
jsalazar@tdxassociates.com
+1 (956) 346-5833",,,1,"TD*X Associates, LP",TEXAS ECOLOGY - US ECOLOGY,3277 CR 69,,Robstown,TX,78380,,956-346-5833,Noah Chemicals,1 Noah Park,,,San Antonio,TX,78249,United States,,,,,,,,,,,,,,,,,,,,,,0,False,,2025-01-09T10:16:16.083-05:00,2025-01-16T12:45:19.393-05:00,[],{},2024-11-01,2024-11-11
900425,Entered,0008999,"Atotech USA, LLC",2024-12-03 05:00:00,2025-03-04T00:00:00-05:00,2024-12-20T00:00:00-05:00,True,False,False,False,455.75,1,1997768,0012,1,1,100,AAA COOPER,,"San Antonio, TX",THIRD PARTY,,,,CFR49-HM181,,,"S/O 882678

Ship one lot or minimum possible.

JARRET LOGISTICS SYSTEMS, INC
1347 North Main St.
Orville OH, 44667
866-654-1197
atotechusa@gojarrett.com

The following is required on all documents, labels and BOL:

Atotech PO No. 1983168 
Atotech Material No. 1665095 
Noah Code No. C2797
Noah Lot No. ________

Tech data sheet must also include Country of Origin, Date of Manufacture, Insp/Retest Date.  

Insp/Retest Date should be noted on the product labels.

Mark B/L:
Delivery Hours:  Weekdays 7:00 am - 1:00 pm   
No parking outside gates 
Delivery appointment not required

Send copy of BOL (referencing PO 1983168) & Freight Invoice to: 
Third Party Billing:
Atotech C/O Jarrett Logistics
1347 N Main St
Orrville, Oh 44667

Email tracking number and tech data sheet to the mark.steele@atotech.com

Email invoice to atotech.rock-invoicesus@atotech.com
You can send multiple PDF invoices in a single email - Do not send multiple invoices in a single pdf.

Email invoice to atotech.rock-invoicesus@atotech.com",,,-1,"Atotech USA, LLC",1750 Overview Drive,,,Rock Hill,SC,29730-2000,,(803) 817-3500,Noah Chemicals,1 Noah Park,,,San Antonio,TX,78249,United States,,,,,,,,,,,,,,,,,,,,,,0,False,,2025-01-09T10:41:30.497-05:00,2025-03-04T09:57:41.997-05:00,[],{},2024-12-01,2024-12-02
900426,Entered,0005290,BASF Mobile Emissions Catalyst,2025-01-09 05:00:00,2025-01-20T00:00:00-05:00,2025-01-20T00:00:00-05:00,True,False,False,False,7078.02,1,6000191859,0012,1,1,100,TRUCK,Galvin Maehew,Exworks SanAntonioTX,COLLECT,,,galvin.maehew@basf-catalystsmetals.com,CFR49-HM181,,,"Package in drums/totes clearly stating the lot number, BASF Part #, Gross/Net Weights.   2"" Color tape to be placed around each drum just below the Noah product label as indicated below.  Use color paint for the ears of the totes. 

Ba Acetate Solution - Bright Orange

Put an additional product label on the top of each drum.

Different products should be palletized separately.  Same products with different lot numbers must be palletized separately. 

Use BASF Huntsville assigned totes only.

Check totes to make sure the vent caps and chains are securely attached to the totes.

The following information must be on the BOL:

P.O. #, tote serials # and trailer seal # 

Material to be delivered to BASF on Wednesday, January 22, 2025.

If the weather is going to be 40 deg F or lower between here and Huntsville during the days of transport, use a heated trailer.

When using a heated trailer, make sure to mark the B/L:   TRAILER MUST MAINTAIN A TEMPERATURE BETWEEN 70 - 85 deg. F.

To arrange for transport send an email to  Landstar at totlslg@landstarmail.com the Wednesday prior to the ship date with all the shipping details including P.O. number and delivery date.

Truck is to be exclusive use with an NTC seal applied after loading.    

P/L & C/A to be sent to HuntsvilleQC@basf-catalystsmetals.com. If emails don't go through fax to QC at (256) 774-4772

Send packing list and COA as soon as the order leaves our warehouse

Email invoice to Payables-Invoice-US32@basf-catalystsmetals.com",,,6,HUNTSVILLE PLANT AUTOMOTIVE,9800 Kellner Road,,,Huntsville,AL,35824,USA,(256) 464-6220,Noah Chemicals,1 Noah Park,,,San Antonio,TX,78249,United States,,,,,,,,,,,,,,,,,,,,,,0,False,,2025-01-09T12:15:37.503-05:00,2025-01-20T15:10:17.48-05:00,[],{},2025-01-01,2025-01-06
900427,Entered,0009628,BASF Catalysts South,2025-01-13 05:00:00,2025-01-08T00:00:00-05:00,2025-01-08T00:00:00-05:00,True,True,False,False,0.0,1,6000189545,0012,1,1,100,SEA FREIGHT,1,ExWorks San Antonio,COLLECT,,,celokuhle.shezi@basf-catalystsmetals.com,CFR49-HM181,,SAGE SO 883624,"Same material with different lot numbers must be palletized separately

Prior to shipping, email C/A to
rawmaterial-coa@basf.com, snethemba.oreilly@basf-catalystsmetals.com, and eunita.ingram@basf-catalystsmetals.com

Send copy of all shipping documents to:
snethemba.oreilly@basf-catalystsmetals.com

Packaged in fiber drums clearly stating the lot number, BASF Part Number, gross weight and net weight.  In addition, 2"" red color tape shall be placed around the drum just below the Noah product label as follows:

BaSulfate - Red

Barium Sulfate - Make sure a 100 gm retention sample has been pulled for each lot shipped

Palletization:  Use the 45"" x 45"" pallets.
Pack 8 x 20 gal drums per skid,
Pack 5 x 30 gal drums per skid.

Contact forwarder for shipping arrangements.
- VERIFY - 
Forwarder:  Rohlig 
(Sea) iah-export-ocean@jas.com 
(South Africa): BrettR@rohlig.co.za or kwandal@rohlig.co.za

Expeditors International (For Air Export DG / Non-DG ocean and air cargo)
8206 Cross Park, Suite 300
Austin,  TX   78754
Telephone:  (512)491-8610 main
Fax: (5121)491-8161

Email invoice to Payables-Invoice-ZAE1@basf-catalystsmetals.com",,,-1,BASF Catalysts South,Africa (Pty.) Ltd.,425 Struanway Struandale,"ZA Port Elizabeth, 6001",.,.,.,SA,011 27-41-4011000,Noah Chemicals,1 Noah Park,,,San Antonio,TX,78249,United States,,,,,,,,,,,,,,,,,,,,,,0,False,,2025-01-09T15:20:14.48-05:00,2025-01-09T15:29:17-05:00,[],{},2025-01-01,2025-01-13
900428,Entered,0009774,BASF Catalisadores Ltda.,2024-12-23 05:00:00,2025-01-13T00:00:00-05:00,2025-01-13T00:00:00-05:00,True,False,False,False,255.0,1,6000189545,0012,1,1,100,SEA FREIGHT,,ExworksSan AntonioTX,COLLECT,,,,CFR49-HM181,,Sage S/O 883624,"Package in drum stating lot #, BASF Part #, gross wt and net wt. 2"" red tape placed around the drum below product label. 4 drums/ pallet

100 gm retention sample needed

Use wood pallets with fumigation stamp - ""Do Not Double Stack"" must be on BOL.  Label top of each drum with ""Topload Only-Do Not Stack""

C/A & SDS to be sent with shipment but not shown on paperwork.  

Original invoice/duplicate and packing list must be signed in blue ink

The following statement must be on the packing, IMO, airbill and/or bill of lading:  Wooden Packing: Treated and Certified

VIA SEAFREIGHT:
Carotrans International 
3838 N Sam Houston Pkwy, Ste 110
Houston, TX  77032
Jhasmin.bautista@e-craft.com

Notify Field:
Indaiá Santos - SP
Rua XV de Novembro, 170 Santos, SP Brasil.
Cep: 11.010-150 Phone: (13) 3211-4000
CNPJ: 58.156.084/0001-37
Telephone/Fax: 55 (13) 3211 - 4014

Email the signed original invoice, packing list and wood pallet cert to the forwarder.  

Email the signed original invoice, packing list, CofA, wood pallet certification & tracking number for PBL documents to thalita.perico@partners.basf-catalystsmetals.com
ana.albinosilva@basf-catalystsmetals.com
breno.furlaneto-horvath@basf-catalystsmetals.com

Email invoice to Payables-Invoice-BRE1@basf-catalystOriginals must be sent a max of 5 days after vessel sails

Mandatory Info for B/L or AWB:
Consignee CNPJ:48.539.407/0029-19
Indaia CNPJ:58.156.084/0001-37
NCM Tariff Number:
Gross Wt:(incl pallet wt)
Cargo Cubic Meter:
Packaging Types:Drums, Pallets 
Freight Charges:

Mandatory info printed on the commercial invoice: Volume qty (i.e. 2 pallets with 10 drums)/
Gross wt-incl pallet/Net wt/Incoterm

Send original and signed copy of documents by courier to broker in Brazil and send tracking number:
Indaia Santos - SP
Rua XV de Novembro, 170 Santos, SP Brasil
Zip Code:  11.010-150 /Phone:  (13) 3211-4000
CNPJ:  58.156.084/0001-37
Mr. Giliardi Figueiredo",,,8,BASF Catalisadores Ltda.,"Rodovia SP 73, No. 5756",Rod. SP 73 No. 5756,13330-970 Indaiatuba,Indaiatuba-Sao Paulo,.,.,BRZ,011-55-1939355500,Noah Chemicals,1 Noah Park,,,San Antonio,TX,78249,United States,,,,,,,,,,,,,,,,,,,,,,0,False,,2025-01-09T15:27:39.843-05:00,2025-01-15T12:03:35.503-05:00,[],{},2024-12-01,2024-12-23
900429,Entered,15022,North American Höganäs Co.,2025-01-09 05:00:00,2025-01-13T00:00:00-05:00,2025-01-13T00:00:00-05:00,True,False,False,False,0.0,1,Sample Email Order,0006,1,1,100,UPS NEXT DAY,Andrew Hoffman,FOB,COLLECT,,,andrew.hoffman@hoganas.com,UPS Ground / FedEx Ground,,"Attn: Allison Endler

Use their UPS Account Number 241-437",,,,1,Attn: Allison Endler,North American Höganäs High Alloys LLC,101 Bridge Street,,Johnstown,PA,15902,,814 361 6875,Noah Chemicals,1 Noah Park,,,San Antonio,TX,78249,United States,,,,,,,,,,,,,,,,,,,,,,0,False,,2025-01-09T16:11:33.05-05:00,2025-01-14T16:30:14.27-05:00,[],{},2025-01-01,2025-01-06
900430,Entered,0008745,"Glanbia Nutritionals (NA), Inc",2024-12-18 05:00:00,2025-01-23T00:00:00-05:00,2025-01-23T00:00:00-05:00,True,False,False,False,1462.75,1,4504619442,0012,1,1,100,UPS GROUND,Shannon Provenzano,ExWorks SanAntonioTX,COLLECT,,,,,,,"UPS Account No.: E4277J

Email documents, COA, and order confirmation to Shannon Provenzano at sprovenzano@glanbia.com

Materials must have a minimum of 75% shelf life remaining, materials received with less will be refused unless prior approval is given.

BOL must state: Delivery Appointment is Required

Call 203-932-3000 Ext: 7288 for appointment

Material must be laveled with the internal GN Code on each unit or placarded on pallet

Wood packing is NOT acceptable.

Original manufacturer labels must be on each unit.

Maximum pallet height is 5 ft for Mo/CA shipments, 53#  for CT shipment

Email invoices to:   ssna@glanbia.com",,,1,"Glanbia Nutritionals (NA), Inc",50 Prindle Hill Road,,,Orange,CT,06477,,,Noah Chemicals,1 Noah Park,,,San Antonio,TX,78249,United States,,,,,,,,,,,,,,,,,,,,,,0,False,,2025-01-09T16:22:16.85-05:00,2025-01-27T11:12:23.227-05:00,[],{},2024-12-01,2024-12-16
900431,Entered,0012958,Verily Life Sciences,2025-01-09 05:00:00,2025-01-14T00:00:00-05:00,2025-01-14T00:00:00-05:00,True,False,False,False,1642.4016,1,Email order 9 Jan 25,0006,1,1,100,FEDEX GROUND,Jo Ohm,FOB,COLLECT,,,joohm@verily.com,UPS Ground / FedEx Ground,,"Use FedEx account 692904281

send invoice to joohm@google.com - she is going to pay by credit card - dont go through formal route via Embark etc","Use FedEx account 692904281

send invoice to joohm@google.com - she is going to pay by credit card - dont go through formal route via Embark etc",,,-1,Verily Life Sciences,279 East Grand Avenue,,,South San Francisco,CA,94080,USA,(650) 278-3708,Noah Chemicals,1 Noah Park,,,San Antonio,TX,78249,United States,,,,,,,,,,,,,,,,,,,,,,0,False,,2025-01-09T17:09:56.053-05:00,2025-01-16T11:36:50.207-05:00,[],{},2025-01-01,2025-01-06
900432,Entered,15016,"Harcros Chemicals, Inc.",2025-01-09 05:00:00,2025-01-15T00:00:00-05:00,2025-01-15T00:00:00-05:00,True,False,False,False,3769.5,1,051002228,0012,1,1,100,S.A.I.A.,Tammy Haggart,ExWorks SanAntonioTX,THIRD PARTY,,,tammy.haggart@harcros.com,CFR49-HM181,,,"Send order confirmations and tracking number to Tammy Haggart at tammy.haggart@harcros.com

PO Number 051002228 must be on invoice, BOL, Labels, and Packing lists.

NMFC and Proper Shipping Name must be on BOL

Please put the following on the BOL: (Third Party Billing)
Bill Freight To:
Central Garden & Pet
C/O Class Information Systems


PO Box 67
St. Louis, MO 63166

Send invoices to AP@harcros.com and Tammy  tammy.haggart@harcros.com.

Do not repackage materials. Place Noah Labels on bags.",,,-2,Farnam Companies,C/O CONTINENTAL LABORATORIES,912 S STATE ST,,MADRID,IA,50156-1748,USA,402-331-4525,Noah Chemicals,1 Noah Park,,,San Antonio,TX,78249,United States,,,,,,,,,,,,,,,,,,,,,,0,False,,2025-01-09T17:49:42.027-05:00,2025-01-16T18:43:46.133-05:00,[],{},2025-01-01,2025-01-06
900433,Entered,0015014,Kingston Process Metallurgy,2025-01-08 05:00:00,2025-01-13T00:00:00-05:00,2025-01-13T00:00:00-05:00,True,False,False,False,0.0,1,KM1931-28-1,0008,1,1,100,FEDEX INT'L,Kris Mackowiak,EXWorks SanAntonioTX,COLLECT,,,,IATA,,"This is a partial ship of SO No. 900400. The material was paid for in-full per SO No. 900400, so payment terms are marked as No Charge.","SPECIAL INSTRUCTIONS:

Shipping via FedEx International Priority Account No. 6610-9740-0

Please contact Kris Mackowiak - 613-634-2022 Ext 123 and also email Kris Mackowick at kris.mackowiak@kpm.ca to arrange pick up. 

You can send any freight or shipment related documents / inquiries to freight@kpm.ca 

Some documents which they will require include:
Commercial Invoice / Canada Customs Invoice
Any other Relevant Customs Documents, permits etc.
Packing List
Ocean Bill of Lading
Arrival Notice / Advise Notice
 
Invoice and any payment related information / inquires to ap@kpm.ca",,,1,Kingston Process Metallurgy - Norris,599 Norris Ct.,,,Kingston,ON,K7P2R9,Canada,613-634-2022,Noah Chemicals,1 Noah Park,,,San Antonio,TX,78249,United States,,,,,,,,,,,,,,,,,,,,,,0,False,,2025-01-10T10:00:08.573-05:00,2025-01-14T16:41:53.6-05:00,[],{},2025-01-01,2025-01-06
900434,Entered,0010136,Eagle Picher Technologies,2024-10-24 04:00:00,2025-01-13T00:00:00-05:00,2024-12-03T00:00:00-05:00,True,False,False,False,8874.0,1,D225126,0006,1,1,100,R & L CARRIERS,Dillan Whistler,ExWorks-SanAntonioTX,THIRD PARTY,,,,CFR49-HM181,,SAGE - Saloes order # 0881138,"THIS IS A BLANKET ORDER 


PO No D225126 and Eagle Picher Acct No  must be referenced in the ""Shipper Reference"" or ""Billing  Reference"" area of all BOL, air bills and on all shipping labels, packing list and invoices. 

Must include COC with each shipment. COC must include Eagle Picher's PO No,D225126 and Part No 11-16-114-0; REV. A  

Must assure that a minimum of 75% of the shelf life is remaining at time of receprt at Eagle Picher. 

Tech Data Sheet must include the Manufacture Date and Retest Date.

LTL
UPS Freight or YRC - Third Party
Do Not use FedEx LTL Priority or Economy 
Account: Worldwirde Express W822199749 

Third Party Billing
Eagle Picher c/o Worlwide Express
2323 Victory Avenue
Suite 1600
Dallas, TX, 75219

Email SCFreight@wwex.com with shipment details for BOL and to schedule pickup.

Reference Account No W822199749

Third party billing instructions must appear on the BOL

Send Tracking information to Dillan Whistler at dillian.whistler@eaglepicher.com

Email for electronic invoicing: ap@eaglepicher.com",,,7,Eagle Picher Technologies,"1215 West ""C"" Street",,,Joplin,MO,64801,USA,(602) 794-9600,Noah Chemicals,1 Noah Park,,,San Antonio,TX,78249,United States,,,,,,,,,,,,,,,,,,,,,,0,False,,2025-01-10T10:22:35.483-05:00,2025-01-16T12:59:19.193-05:00,[],{},2024-10-01,2024-10-21
900435,Entered,0012063,HACH Company,2025-01-03 05:00:00,2025-01-14T00:00:00-05:00,2025-01-14T00:00:00-05:00,True,False,False,False,420.0,1,690080-1,0024,1,1,100,Fedex Freight Priority,David Moore,EXWorks SanAntonioTX,COLLECT,,,,CFR49-HM181,PO No. 690080-1,This is a 1/2  partial ship of HACH'S PO# 690080.,"SPECIAL INSTRUCTIONS:

SALES: Follow Supplier Routing Instructions Memo

FedEx Ground/Air Acct. No. 0503-0114-1 (Ames, IA)

Ground shipments > 400 lbs or hazards, ship via FedEx Freight Priority (for Ames, IA and Loveland, CO)  (Includes Sodium Cyanide and Potassium Cyanide)

THIRD PARTY BILLING:
Hach Company
c/o US Bank
P.O. Box 3001
Naperville, IL  60566-7001

ALWAYS okay to ship early unless otherwise notified for end of year purchases

Do not declare or insure any shipment. HACH is self-insured.

All shipping documents and product labels must contain PO Number 690080.  

Email tracking number to David Moore at damoore@hach.com

Email invoice to accountspayable@hach.com and damoore@hach.com

Send TDS to buyer on PO and Dennis Mokaya at dmokaya@hach.com

Send copy of packing slip with every shipment.",,,1,HACH Company,100 Dayton Ave,,,Ames,IA,50010,,,Noah Chemicals,1 Noah Park,,,San Antonio,TX,78249,United States,,,,,,,,,,,,,,,,,,,,,,0,False,,2025-01-10T12:51:44.793-05:00,2025-01-16T12:24:41.717-05:00,[],{},2025-01-01,2024-12-30
