OrderNumber,OrderStatus,CustomerNumber,CustomerName,OrderDate,ShipDate,PromisedDate,Closed,CreditHold,OnHold,BlanketOrder,Amount,OrderType,CustomerPurchaseOrderNumber,SalesAgent,Division,Warehouse,TaxCode,ShipperID,Attention,FOB,FreightOption,FreightAmount,FreightCost,Email,FreeField1,FreeField2,OrderRemarks,InternalRemarks,OrderRemark3,OrderRemark4,ShipToSequence,ShipToName,ShipToAddress1,ShipToAddress2,ShipToAddress3,ShipToCity,ShipToState,ShipToZip,ShipToCountry,Phone,ShipFromName,ShipFromAddress1,ShipFromAddress2,ShipFromAddress3,ShipFromCity,ShipFromState,ShipFromZip,ShipFromCountry,MiscCharge1,MiscCharge1GL,MiscCharge1Reason,MiscCharge1Tax,MiscCharge2,MiscCharge2GL,MiscCharge2Reason,MiscCharge2Tax,MiscCharge3,MiscCharge3GL,MiscCharge3Reason,MiscCharge3Tax,MiscCharge4,MiscCharge4GL,MiscCharge4Reason,MiscCharge4Tax,NumberOfPallets,ShippingZone,Truck,TruckRunId,TruckRunDate,StopNumber,StandingOrderRelease,ExternalTracking,CreateDate,UpdateDate,items,CustomFields,Month,Week
900206,Entered,0002090,Thermo Fisher Scientific,2024-10-21 04:00:00,2024-11-22T00:00:00-05:00,2024-11-22T00:00:00-05:00,True,False,False,False,3663.0,1,444270,0024,1,1,100,FEDEX GROUND,Cathy Thompson,ExWorks-SanAntonioTX,COLLECT,,,jeff.oconnor@alfa.com,,,SAGE sales order 0880940,"FedEx Acct: 131930984

Certificate of Origin required with all shipments

PO Number 444270 must be on all shipping documents and labels

Tech data must state the following:  
This material is chemically synthesized
Country of Origin USA 

All products must have the following marked on the inner labels and outer packaging:
Country of Origin:USA  

Email invoice to alfaaesar.accountspay@thermofisher.com

Email tracking information to Cathy.Thompson@ThermoFisher.com

Email Tech Data Sheet and SDS to QCdocs@alfa.com

Email Tech Data Sheet and Certificate of Origin to alfaaesar.qcdocs@thermofisher.com

FOR SHIPMENTS TO WARD HILL, MA:

Do not declare a value for insurance purposes
Do not decalre a value for carriage
PO No 444270 must be put in the proper field for FedEx and UPS shipments
PO No 444270 must be on BOL
Shipping paperwork should reflect the name Thermo Fisher Scientific 

The P.O. will specify the method of shipment. In most cases this will be either FedEx or UPS. Should the P.O. specify UPS or FedEx and the order cannot ship small package (due to size or carrier restrictions) please ship LTL using the following chart to determine the correct carrier.",,,-1,Thermo Fisher Scientific,Chemicals Inc.,2 Radcliff Road,,Tewksbury,MA,01876,USA,(978) 521-6490,Noah Chemicals,1 Noah Park,,,San Antonio,TX,78249,United States,,,,,,,,,,,,,,,,,,,,,,0,False,,2024-10-21T15:27:03.74-04:00,2024-11-25T15:39:31.667-05:00,[],{},2024-10-01,2024-10-21
900207,Entered,0012958,Verily Life Sciences,2024-10-18 04:00:00,2024-12-13T00:00:00-05:00,2024-11-18T00:00:00-05:00,True,True,False,False,8582.4016,1,4100020791,0006,1,1,100,FEDEX FRT PRIOR,Jo Ohm,Exworks-SanAnonTX,COLLECT,,,,CFR 49 - HM181,,SAGE sales order 0880973,"FedEx Acct No. 692904281

Do not ship orders early with out approval

Email shipping notifications before sending material to Joohm@verily.com

Verify will not pay any invoice submitted 180days or ore after product shipped

Email invoices to accountspayable@verily.com",,,-1,Verily Life Sciences,279 East Grand Avenue,,,South San Francisco,CA,94080,USA,(650) 278-3708,Noah Chemicals,1 Noah Park,,,San Antonio,TX,78249,United States,,,,,,,,,,,,,,,,,,,,,,0,False,,2024-10-21T15:56:31.463-04:00,2024-12-17T16:20:25.837-05:00,[],{},2024-10-01,2024-10-14
900208,Entered,0012785,Consolidated Nuclear Security,2024-10-07 04:00:00,2024-10-21T00:00:00-04:00,2024-10-21T00:00:00-04:00,True,True,False,False,60377.06,1,4300178574,0115,1,1,100,,,,,,,,,,,"SAGE SO 0880478

Email invoice to acctspaymms@pxy12.doe.gov and cc jerry.ladd@pxy12.doe.gov

Email copy of payment table to jerry.ladd@pxy12.doe.gov in a separate email",,,-1,Consolidated Nuclear Security,Accounts Payable,P.O. Box 2009,,Oak Ridge,TN,37831-8265,USA,(865) 576-2826,Noah Chemicals,1 Noah Park,,,San Antonio,TX,78249,United States,5440,4100,Milestone 2 - Major Material Purchase Confirmation,N,1029.37,4100,Milestone 3 - Thallium Melting Equipment Purchase,N,45410,4100,Milestone 4 & 5 - Lab Analytical Process Method Development,N,8497.69,4100,Milestone 6 - Delivery,N,,,,,,0,False,,2024-10-21T17:00:19.56-04:00,2024-10-21T17:02:38.273-04:00,[],{},2024-10-01,2024-10-07
900209,Entered,15001,LANDUS,2024-10-16 04:00:00,2024-11-21T00:00:00-05:00,2024-11-21T00:00:00-05:00,True,True,False,False,4378.0,1,Email Order - PO 12288,0008,1,1,100,FEDEX FRT ECO,Kevin Grundmeier,ExWorks-SanAntonioTX,PPD,,,Kevin.Grundmeier@landus.ag,,,SAGE sales order # 0880841,Freight built into the cost of materail,,,-1,LANDUS,406 1st St,,,Ralston,IA,51459,USA,515-210-1463,Noah Chemicals,1 Noah Park,,,San Antonio,TX,78249,United States,,,,,,,,,,,,,,,,,,,,,,0,False,,2024-10-22T09:49:24.963-04:00,2024-11-22T13:23:04.75-05:00,[],{},2024-10-01,2024-10-14
900210,Entered,0014210,"Hickman, Williams & Company",2024-08-27 04:00:00,2024-10-23T00:00:00-04:00,2024-08-29T00:00:00-04:00,True,True,False,False,8800.0,1,100124080540,0006,1,1,100,TRUCK,,"ExWorks Belpre, OH",PPD,,,,,,,"S/O 0878861

Drop Shipment
Contact Wetz Warehousing for delivery appointment
Ramona Cox
Phone: 740-373-9028  Ext. 122


Send copies of shipping documents to dsandala@hicwilco.com

Email invoice to APinvoicing@ascendelements.com",,,1,"Hickman, Williams & Company","WETZ WAREHOUSE, LLC (SITE)",1106 Putnam Howe Dr.,,Belpre,OH,45714,USA,513-621-1946,Noah Chemicals,1 Noah Park,,,San Antonio,TX,78249,United States,,,,,,,,,,,,,,,,,,,,,,0,False,,2024-10-23T10:44:22.54-04:00,2024-10-23T10:45:06.263-04:00,[],{},2024-08-01,2024-08-26
900211,Entered,0009554,Cascade Columbia Distribution,2024-10-22 04:00:00,2024-10-25T00:00:00-04:00,2024-10-25T00:00:00-04:00,True,False,False,False,587.32,1,BL908694,0024,1,1,100,UPS GROUND,Stuart Hunt,ExWorks-SanAntonioTX,PPD & ADDED,287.32,,,,,SAGE sales order # 0881050,"Shipping Via Noah UPS Account No. 819430

Minimum of 80% remaining Shelf Life required

Certificate of Origin, COA and packing list required with all shipments
Pallets and blocking must be fumigated and stamped., All documents and labeling must be in english. 

Include Date of Manufacture on Tech Data Shee

Email tech data sheet to Sharon Swanson at sharons@cascadecolumbia.com and Whitney Klaus at whitneyk@cascadecolumbia.com

Email invoice and documentation to ap_invoice@cascadecolumbia.com",,,7,Cascade Columbia Distribution,825 9th STREET NW,,,Salem,OR,97304,USA,(503) 625-5293,Noah Chemicals,1 Noah Park,,,San Antonio,TX,78249,United States,,,,,,,,,,,,,,,,,,,,,,0,False,,2024-10-23T13:43:13.753-04:00,2024-10-28T15:42:00.927-04:00,[],{},2024-10-01,2024-10-21
900212,Entered,0011210,ENGI-Mat,2024-10-22 04:00:00,2024-10-25T00:00:00-04:00,2024-10-25T00:00:00-04:00,True,True,False,False,2828.15,1,35570--DB,0006,1,1,100,UPS GROUND,2,ExWorks-SanAntonoTX,COLLECT,,,,,,Sage sales order # 0881061,"UPS Acct. No. 233-5EW   

Email invoice and tracking number to Dan Bugaris, Ph.D at dbugaris@engi-mat.com

Email invoices to: accountspayable@engi-mat.com",,,-1,ENGI-Mat,2436 Over Drive,,,Lexington,KY,40511,USA,859-259-3637,Noah Chemicals,1 Noah Park,,,San Antonio,TX,78249,United States,,,,,,,,,,,,,,,,,,,,,,0,False,,2024-10-23T13:53:24.49-04:00,2024-10-28T16:04:35.207-04:00,[],{},2024-10-01,2024-10-21
900213,Entered,0012063,HACH Company,2024-10-22 04:00:00,2024-10-29T00:00:00-04:00,2024-10-29T00:00:00-04:00,True,False,False,False,210.0,1,682734,0024,1,1,100,FEDEX GROUND,Brian Jewell,ExWorks-SanAntonioTX,COLLECT,,,,,,Sage sales order # 0881039,"FedEx Ground/Air Acct. No. 0503-0114-1 (Ames, IA)

Ground shipments < 400 lbs or non-haz, use FedEx Ground.

ALWAYS okay to ship early unless otherwise notified for end of year purchases

Do not declare or insure any shipment. HACH is self-insured.

All shipping documents and product labels must contain PO Number 682734.  

Email tracking number to Brian Jewell
at bjewell@hach.com

Email invoice to accountspayable@hach.com and bjewell@hach.com

Send TDS to Brian Jewell
 at bjewell@hach.com and Dennis Mokaya at dmokaya@hach.com

Send copy of packing slip with every shipment.",,,1,HACH Company,100 Dayton Ave,,,Ames,IA,50010,,,Noah Chemicals,1 Noah Park,,,San Antonio,TX,78249,United States,,,,,,,,,,,,,,,,,,,,,,0,False,,2024-10-23T16:03:39.22-04:00,2024-10-29T11:46:19.95-04:00,[],{},2024-10-01,2024-10-21
900214,Entered,0009606,Catalytic Combustion Corp,2024-10-23 04:00:00,2024-10-22T00:00:00-04:00,2024-10-22T00:00:00-04:00,True,False,False,False,1837.2,1,,0000,1,1,100,UPS GROUND,,Exworks SanAntonioTX,,,,,,,Sage S/ 880665,"UPS Acct. No. 583-828

For UPS Shipments - do not declare value for insurance

Include Catalytic Combustion Part No. on invoice and product label

Code 90153 = Part No. 1001319

Email invoices to ap@catalyticcombustion.com

Send tracking information to purchasing agent 

Contact Dave Pike, dpike@catalyticcombustion.com or 715-568-2882, for any questions or correspondence.",,,1,Catalytic Combustion Corp,709 21st Ave,,,Bloomer,WI,54724,,,Noah Chemicals,1 Noah Park,,,San Antonio,TX,78249,United States,,,,,,,,,,,,,,,,,,,,,,0,False,,2024-10-23T16:11:47.62-04:00,2024-10-23T16:13:07.773-04:00,[],{},2024-10-01,2024-10-21
900215,Entered,0012046,"Cambrex Charles City, Inc.",2024-10-23 04:00:00,2024-11-12T00:00:00-05:00,2024-11-25T00:00:00-05:00,True,True,False,False,2025.0,1,4500140458,0006,1,1,100,FEDEX FRT PRIOR,Barbara Musel,ExWorks-SanAntonioTX,COLLECT,,,Abiye.Asefa@cambrex.com,,,SAGE sales order # 881028,"FedEx Acct No: 149294058

Include PO No. 4500140458 on all shipping documents, MSDS, TDS and labels 

For each delivery a COA is required. 

All materials must be shipped with a minimum of 75% of shelf life remaining. If material is received under the 75% shelf life remaining it is ar Cambrex's discretion as to acceptance. 

Email invoices: cccap@cambrex.com",,,-1,"Cambrex Charles City, Inc.",1205 Eleventh Street,,,Charles City,IA,50616,USA,(641) 257-1000,Noah Chemicals,1 Noah Park,,,San Antonio,TX,78249,United States,,,,,,,,,,,,,,,,,,,,,,0,False,,2024-10-23T16:17:16.24-04:00,2024-11-12T17:38:11.947-05:00,[],{},2024-10-01,2024-10-21
900216,Entered,0002620,Southwest Research Institute,2024-10-18 04:00:00,2024-10-23T00:00:00-04:00,2024-10-23T00:00:00-04:00,True,False,False,False,280.0,1,TO0256MM,0008,1,1,100,UPS GROUND,,EXworks SanAntonioTX,COLLECT,,,,,,Sage S/O 0880984,"UPS Acct No 752-709

Include the date of manufacture, the inspect/retest date on the tech data

Email the invoice to ap@swri.org.",,,-1,Southwest Research Institute,P.O. Box 28510,,,San Antonio,TX,78228,USA,(210) 522-3859,Noah Chemicals,1 Noah Park,,,San Antonio,TX,78249,United States,,,,,,,,,,,,,,,,,,,,,,0,False,,2024-10-24T10:29:00.057-04:00,2024-10-24T10:31:05.377-04:00,[],{},2024-10-01,2024-10-14
900217,Entered,0005308,MP Biomedicals LLC,2024-10-24 04:00:00,2024-10-24T00:00:00-04:00,2024-10-24T00:00:00-04:00,True,True,False,False,293.83,1,1009416,0024,1,1,100,,1,,,,,,,,,,,,-1,MP Biomedicals LLC,29525 Fountain Parkway,Attn: Accounts Payable/MSDS,Melissa Tenney,Solon,OH,44139,USA,(440) 337-1200,Noah Chemicals,1 Noah Park,,,San Antonio,TX,78249,United States,293.83,4100,Freight Charges for Invoice B-0639191,N,,,,,,,,,,,,,,,,,,0,False,,2024-10-24T10:33:41.043-04:00,2024-10-24T11:21:03.06-04:00,[],{},2024-10-01,2024-10-21
900218,Entered,14291,ERC INC,2024-10-10 04:00:00,2024-10-23T00:00:00-04:00,2024-10-23T00:00:00-04:00,True,True,False,False,3742.0,1,PR00025501,0006,1,1,100,UPS GROUND,,ExWorks SanAntonioTX,PPD & ADDED,,,,,,S/O 880621,,,,1,ERC II LASSO II LABS,Building M6-744,KSC Central Receiving,,Kennedy Space,FL,32899,USA,,Noah Chemicals,1 Noah Park,,,San Antonio,TX,78249,United States,,,,,,,,,,,,,,,,,,,,,,0,False,,2024-10-24T10:49:45.62-04:00,2024-10-28T10:29:42.937-04:00,[],{},2024-10-01,2024-10-07
900219,Entered,15002,"RSI Holdings Group, LLC",2024-10-17 04:00:00,2024-11-18T00:00:00-05:00,2024-11-18T00:00:00-05:00,True,True,False,False,4711.895,1,BB1024,0008,1,1,101,TRUCK,Elijah Cole,ExWorks-SanAntonioTX,COLLECT,457.67,,,,,Sage sales order # 0880896,"Shipping Amino 
Quote ID: 120505882

Main contact is Elijah Cole - 903-686-1549

Email invoices to 
elijah@rotorstoneinvestments.com and 
ashley@rotorstoneinvestments.com",,,-1,"RSI Holdings Group, LLC",2000 E Cotton,,,Longview,TX,75602,,903-686-1549,Noah Chemicals,1 Noah Park,,,San Antonio,TX,78249,United States,,,,,,,,,,,,,,,,,,,,,,0,False,,2024-10-24T11:17:11.03-04:00,2024-10-24T16:24:25-04:00,[],{},2024-10-01,2024-10-14
900220,Entered,0014283,"Metal Improvement Co., LLC",2024-10-24 04:00:00,2025-01-20T00:00:00-05:00,2025-01-17T00:00:00-05:00,True,False,False,False,27900.0,1,1977,0026,1,1,100,R & L CARRIERS,Nicole King,ExWorks-SanAntonioTX,THIRD PARTY,,,Purchasing@everlubeproducts.com,CFR49-HM181,,SAGE order # 0880874,"**Ship VIA CHR***
E-mail: Curtiss-Wright@chrobinson.com
Phone: 800-245-2706
3rd party bill to:
CHRLTL
1480 Charlson Road # 2100
Eden Prairie MN 55347

Include AMS-M-7866 COA with shipment. Packed in Drums 

Email COA to Purchasing@everlubeproducts.com

The vendor-supplied test report, Certificate of Compliance / Analysis shall include the following information as a minimum:

Shelf life must have a minimum of 75% remaining  shelve life as defeined by the manufacturer. 

Commodity solvents must have a minimum of 6 months remaining shelf life.

If the material purchased has a limited shelf life, the certification must state the date of manufacture and/or the expiration date. 

Material Manufacturer / Producer / Vendor
Name of Material
Batch or Lot Number of Material
Material Characteristics and Test Results
Everlube Products Purchase Order Number 1953
Date of Manufacture, Shipment, Packaging, Dispatch, or Expiration",,,-1,"Metal Improvement Co., LLC",100 Cooper Circle,,,Peachtree City,GA,30269,USA,770-261-4800,Noah Chemicals,1 Noah Park,,,San Antonio,TX,78249,United States,,,,,,,,,,,,,,,,,,,,,,0,False,,2024-10-24T16:08:07.633-04:00,2025-01-22T09:47:08.013-05:00,[],{},2024-10-01,2024-10-21
900221,Entered,15002,"RSI Holdings Group, LLC",2024-10-17 04:00:00,2024-11-18T00:00:00-05:00,2024-11-18T00:00:00-05:00,True,True,False,False,4379.2205,1,BB1024,0008,1,1,100,TRUCK,Elijah Cole,ExWorks-SanAnrtonio,COLLECT,457.67,,,,,SAGE sales order # 0880896,"Shipping Amino 
Quote ID: 120505882

Main contact is Elijah Cole - 903-686-1549

Email invoices to 
elijah@rotorstoneinvestments.com and 
ashley@rotorstoneinvestments.com",,,-1,"RSI Holdings Group, LLC",2000 E Cotton,,,Longview,TX,75602,,903-686-1549,Noah Chemicals,1 Noah Park,,,San Antonio,TX,78249,United States,,,,,,,,,,,,,,,,,,,,,,0,False,,2024-10-24T16:29:20.907-04:00,2024-12-03T09:38:56.783-05:00,[],{},2024-10-01,2024-10-14
900222,Entered,0012923,Heirloom Carbon Technologies,2024-07-18 04:00:00,2024-07-24T00:00:00-04:00,2024-10-24T00:00:00-04:00,True,False,False,False,1930.5,1,10690,0024,1,1,100,FEDEX FRT ECO,Rahul Kundu,Exwork SanAntonioTX,COLLECT,,,max@heirloomcarbon.com,,,S/O 0877321,"This completes back order. 

FedEx account 7807-5503-2

Please send invoices to heirloomap@bill.com and lenore.kerber@heirloomcarbon.com, and add ""Attn: Rahul Kundu"" to the shipping address

Prepayment : send invoice immediately, referencing this PO 10690 for fastest response. (please send credit terms application materials for next order)

For timely payments, please include ACH information",,,1,Heirloom Carbon Technologies,Attn: Rahul Kundu,125 Vally Drive,Deliver to Dock 5,Brisbane,CA,94005,USA,(303) 842-4120,Noah Chemicals,1 Noah Park,,,San Antonio,TX,78249,United States,,,,,,,,,,,,,,,,,,,,,,0,False,,2024-10-25T14:23:22.72-04:00,2024-10-25T14:24:14.36-04:00,[],{},2024-07-01,2024-07-15
900223,Entered,0010136,Eagle Picher Technologies,2024-10-24 04:00:00,2024-11-04T00:00:00-05:00,2024-11-04T00:00:00-05:00,True,False,False,False,3253.8,1,D225126 - RELEASE 1,0006,1,1,100,R & L CARRIERS,Dillan Whistler,ExWorks-SanAntonioTX,THIRD PARTY,,,Dillan.Whistler@eaglepicher.com,,,SAGE - Sales order # 0881127,"THIS IS A BLANKET ORDER 

1st Release - 11-04-2024 for delivery 11/08/2024
2nd Release -12-12-2024 for delivery 12/20/2024

PO No D225126 and Eagle Picher Acct No  must be referenced in the ""Shipper Reference"" or ""Billing  Reference"" area of all BOL, air bills and on all shipping labels, packing list and invoices. 

Must include COC with each shipment. COC must include Eagle Picher's PO No,D225126 and Part No 11-16-114-0; REV. A  

Must assure that a minimum of 75% of the shelf life is remaining at time of receprt at Eagle Picher. 

Tech Data Sheet must include the Manufacture Date and Retest Date.

LTL
UPS Freight or YRC - Third Party
Do Not use FedEx LTL Priority or Economy 
Account: Worldwirde Express W822199749 

Third Party Billing
Eagle Picher c/o Worlwide Express
2323 Victory Avenue
Suite 1600
Dallas, TX, 75219

Email SCFreight@wwex.com with shipment details for BOL and to schedule pickup.

Reference Account No W822199749

Third party billing instructions must appear on the BOL

Send Tracking information to Dillan Whistler at dillian.whistler@eaglepicher.com

Email for electronic invoicing: ap@eaglepicher.com",,,-1,Eagle Picher Technologies,8230 E. 23rd Street,Attn: Accounts payable - DSP,,Joplin,MO,64804,USA,(602) 794-9600,Noah Chemicals,1 Noah Park,,,San Antonio,TX,78249,United States,,,,,,,,,,,,,,,,,,,,,,0,False,,2024-10-25T15:50:19.8-04:00,2024-11-05T11:26:45.26-05:00,[],{},2024-10-01,2024-10-21
900224,Entered,0011118,"Nexceris, LLC",2024-09-09 04:00:00,2024-10-25T00:00:00-04:00,2024-10-25T00:00:00-04:00,True,False,False,False,11133.045,1,51536,0006,1,1,100,UPS GROUND,,,COLLECT,,,c.spicer@nexceris.com,,,Sage S/O 879345,"UPS Acct. No. 2A8-1T2

This completes your order 

Email invoice to accountspayable@nexceris.com                                

Tax ID #32-034585011",,,-1,"Nexceris, LLC",404 Enterprise Drive,,,Lewis Center,OH,43035,USA,(614) 842-6606,Noah Chemicals,1 Noah Park,,,San Antonio,TX,78249,United States,,,,,,,,,,,,,,,,,,,,,,0,False,,2024-10-28T16:27:28.07-04:00,2024-10-28T16:29:43.04-04:00,[],{},2024-09-01,2024-09-09
900225,Entered,0012010,Aldrich Chemical Co. LLC,2024-10-28 04:00:00,2024-10-25T00:00:00-04:00,2024-10-25T00:00:00-04:00,True,True,False,False,2787.0,1,4103907192,0026,1,1,100,FEDEX FRT ECO,,EXworks SanAntonioTX,COLLECT,,,,,,Sage S/O 880489,"FedEx Acct. No. 1582-9858-9 

Must be one lot unless preapproved by buyer 

Include their part number under our discription if it's not already part of a C-Code description.

Mark each container with the PO number, Sigma-Aldrich part number, and the gross/tare/net weights. 
Email certificate of origin, tech data sheet, and SDS which should include:
Sigma-Aldrich P.O. No.
Sigma-Aldrich Part No.
Country of Origin:  USA
to:  supplierdocs@milliporesigma.com, Attention: Analytical Services + Sigma Aldrich PO number and lot/batch number in the subject line in the format PO#XXX|Batch#


Email tracking number to  (purchasing agent) at dangelo.bell@milliporesigma.com

Email invoice to: usap.invoices@milliporesigma.com     

Email Order confirmation to: aldrichorderacknowledgement@milliporesigma.com(CC  purchasing agent  dangelo.bell@milliporesigma.com)",,,1,Aldrich Chemical Co. LLC,6000 N. Teutonia Ave.,,,Milwaukee,WI,53209,,,Noah Chemicals,1 Noah Park,,,San Antonio,TX,78249,United States,,,,,,,,,,,,,,,,,,,,,,0,False,,2024-10-28T16:59:19.833-04:00,2024-10-28T17:01:13.483-04:00,[],{},2024-10-01,2024-10-28
900226,Entered,0002090,Thermo Fisher Scientific,2024-10-10 04:00:00,2024-10-28T00:00:00-04:00,2024-10-28T00:00:00-04:00,True,False,False,False,3440.0,1,444108,0024,1,1,100,R & L CARRIERS,CATHY,ExWorks San Antonio,COLLECT,,,cathy.thompson@thermofisher.com,,,,"SAGE SO 0880599



Certificate of Origin required with all shipments

PO Number 444108 must be on all shipping documents and labels

Tech data must state the following:  
This material is chemically synthesized
Country of Origin: USA 

All products must have the following marked on the inner labels and outer packaging:
Country of Origin: US A 

Email invoice to alfaaesar.accountspay@thermofisher.com

Email tracking information to Cathy.Thompson@ThermoFisher.com

Email Tech Data Sheet and SDS to QCdocs@alfa.com

Email Tech Data Sheet and Certificate of Origin to alfaaesar.qcdocs@thermofisher.com

LTL Carrier should always be R&L:

Freight charges for LTL must notate the following on the BOL:

Freight charges to be billed to:
Thermo Fisher Scientific, Alfa Aesar / FSCOAA
C/O Data2Logistics
P.O. Box 61050
Fort Myers, FL 33913
               
FOR SHIPMENTS TO WARD HILL, MA:

Do not declare a value for insurance purposes
Do not declare a value for carriage
PO No must be put in the proper field for FedEx and UPS shipments
PO No must be on BOL
Shipping paperwork should reflect the name Thermo Fisher Scientific",,,7,Thermo Fisher Scientific,Alfa Aesar,38 Shelly Road,,Ward Hill,MA,01835,USA,(978) 521-6490,Noah Chemicals,1 Noah Park,,,San Antonio,TX,78249,United States,,,,,,,,,,,,,,,,,,,,,,0,False,,2024-10-29T11:29:34.637-04:00,2024-10-29T11:33:51.83-04:00,[],{},2024-10-01,2024-10-07
900227,Entered,0012766,NEI Corporation,2024-10-04 04:00:00,2024-10-29T00:00:00-04:00,2024-10-29T00:00:00-04:00,True,True,False,False,2930.55,1,PO2855,0024,1,1,100,FEDEX GROUND,,ExWorks SanAntonioTX,,,,jpatel@neicorporation.com,,,S/O 0880324,"OK to part-ship

Fedex Account No. 2479-8730-4

Send tracking information to Ganesh Skandan at gskandan@neicorporation.com

The following number must appear on all related correspondence, shipping papers, and invoices: 
Reference No.: 494677-100224-01
PO: PO2855

Email 2 copies of the invoice to: accounting@neicorporation.com",,,-1,NEI Corporation,400 Apgar Drive,,,Somerset,NJ,08873,USA,(732) 868-1341,Noah Chemicals,1 Noah Park,,,San Antonio,TX,78249,United States,,,,,,,,,,,,,,,,,,,,,,0,False,,2024-10-29T12:06:16.61-04:00,2024-10-29T12:09:03.513-04:00,[],{},2024-10-01,2024-09-30
900228,Entered,0008745,"Glanbia Nutritionals (NA), Inc",2024-10-29 04:00:00,2024-11-05T00:00:00-05:00,2024-11-05T00:00:00-05:00,True,True,False,False,6930.0,1,PO118245,0012,1,1,100,TRUCK,Shannon Provenzano,ExWorks-SanAntonioTX,COLLECT,,,dianne.andreoli@watson-inc.com,,,SAGE sales order # 0881215,"Fill out Freight Entry Form and Shannon Provenzano will arrange pickup. Email: sprovenzano@glanbia.com

Must be on BOL: Contact Jonathan Gonzalez at jonagonzalez@glanbia.com to schedule a delivery appointment.

Bill of Lading must state that a delivery appointment is required. Call
203-932-3000 x7288

Billing purposes, the Transplace BOL is the only BOL to be provided to the carrier

Include Watson Material Code R140312 on the product labels and all shipping documents

Package all orders according to their unit of measure on their purchase order

Ingredients must have a minimum of 70% of shelf life at time of receipt

Only one lot per pallet

Email tech data and tracking number to GN West Haven Procurement gnwatsonproc@glanbia.comand  and CC otilio.perez-colon@watson-inc.com, sprovenzano@glanbia.com

Email invoices to Kissinger, Patricia pkissinger@glanbia.com",,,-1,"Glanbia Nutritionals (NA), Inc",301 Heffernan Drive,,,West Haven,CT,06516,USA,(203) 932-3000,Noah Chemicals,1 Noah Park,,,San Antonio,TX,78249,United States,,,,,,,,,,,,,,,,,,,,,,0,False,,2024-10-29T14:12:23.34-04:00,2024-11-07T14:13:22.697-05:00,[],{},2024-10-01,2024-10-28
900229,Entered,0011418,Nutrisol LLC,2024-10-29 04:00:00,2024-11-15T00:00:00-05:00,2024-11-06T00:00:00-05:00,True,False,False,False,3605.0,1,3673,0012,1,1,100,UPS GROUND,Brent Hagen,ExWorks-SanAntonio,COLLECT,,,bhagen@nutrisolsolutions.com,,,SAGE sales order # 0881237,"UPS Acct. No. 88F-1E1

Email tracking number to:
Brent Hagen at bhagen@nutrisol.com
Danielle Edmonds at dedmonds@nutrisol.com

Email invoices: ap@nutrisol.com
                                
Manufacture and Retest Date required on all TDS",,,-1,Nutrisol LLC,2705 N. Mule Ranch Road,,,Corinne,UT,84307,USA,(435) 744-1035,Noah Chemicals,1 Noah Park,,,San Antonio,TX,78249,United States,,,,,,,,,,,,,,,,,,,,,,0,False,,2024-10-29T14:29:15.34-04:00,2024-11-15T15:17:46.193-05:00,[],{},2024-10-01,2024-10-28
900230,Entered,15003,Whitmore Maufacturing,2024-10-28 04:00:00,2024-11-01T00:00:00-04:00,2024-11-01T00:00:00-04:00,True,False,False,False,0.0,1,Email Sample Order,0024,1,1,100,FEDEX GROUND,Kyle Kirby,ExWorks-SanAntonioTX,COLLECT,,,kyle.kirby@whitmores.com,,,Sage sales order # 0881204,FEDEX ACCT# 368991287,,,-1,Whitmore Maufacturing,1250 Justin Rd.,,,RockWall,TX,75087,USA,,Noah Chemicals,1 Noah Park,,,San Antonio,TX,78249,United States,,,,,,,,,,,,,,,,,,,,,,0,False,,2024-10-29T16:01:58.91-04:00,2024-11-04T17:13:21.827-05:00,[],{},2024-10-01,2024-10-28
